{
  "schema": "https://vmblu.dev/schemas/agents.v1.json",
  "version": 1,
  "defaultInterface": "operator",
  "profiles": [
    {
      "id": "operator",
      "title": "Operator",
      "enabled": true,
      "permissions": {
        "tools": {
          "allow": [],
          "deny": []
        },
        "probes": {
          "allow": [],
          "deny": []
        },
        "events": {
          "allow": [],
          "deny": []
        }
      }
    }
  ],
  "interfaces": [
    {
      "id": "operator",
      "title": "Operator",
      "enabled": true,
      "kind": "embedded",
      "profile": "operator",
      "instructions": "Operate the application through published tools.",
      "llm": {
        "provider": "openai",
        "model": "gpt-4.1-mini",
        "endpoint": "http://127.0.0.1:8080/v1"
      },
      "ui": {
        "mode": "overlay"
      }
    }
  ],
  "provenance": {
    "generated": true,
    "artifact": "agent-configuration",
    "compatibilityFamily": "1.12",
    "schemaVersion": "1.12.4",
    "generator": {
      "name": "@vizualmodel/vmblu-core",
      "version": "1.12.4"
    },
    "source": {
      "model": "playground.mod.blu",
      "hash": "fnv1a64:92ba7b42dab93640"
    }
  }
}